{
  "schema": "evidence-event-v1",
  "event_id": "event-001",
  "observed_at": "2026-09-12T12:00:00Z",
  "operation": "write-summary",
  "path": "/private/tmp/web-dev.log",
  "size": {"logical_before": 1024, "logical_after": 4096, "logical_delta": 3072, "allocated_before": 4096, "allocated_after": 8192, "allocated_delta": 4096},
  "actor": {"process_id": 8123, "executable": "/opt/homebrew/bin/node", "command": "next dev --port 3002", "working_directory": "/Users/example/project", "ancestor_executables": ["codex", "zsh", "pnpm"]},
  "session": {"provider": "codex", "session_id": "session-001", "title": "Test gateway", "working_directory": "/Users/example/project"},
  "attribution": {"confidence": "exact", "method": "endpoint-security", "limitations": []},
  "classification": {"consumer_category": "development-log", "reclaimability": "active", "cleanup_safety": "yellow"},
  "evidence": [{"kind": "endpoint-security-event", "reference": "es:9001"}]
}

